{
  "$schema": "../schemas/character-studio/character-asset-decision-ledger.schema.json",
  "schema_version": "starlight.character_asset_decision_ledger.v1",
  "ledger_id": "starlight-character-asset-decisions-v1",
  "status": "human-review",
  "authority": {
    "visual_identity_only": true,
    "grants_runtime_authority": false,
    "production_mutation_allowed": false,
    "human_owner": "Frank Riemer"
  },
  "sources": {
    "canonical_portfolio": "portfolio/canonical-portfolio.v1.json",
    "civilization_projection": "portfolio/civilization-portfolio.v2.json",
    "v1_provenance": "assets/starlight-constellation/v1/visual-provenance.manifest.json",
    "morphology_system": "assets/starlight-constellation/v2-preview/research-team/face-eye-study-v1/ROBOT_MORPHOLOGY_SYSTEM_V2.md",
    "morphology_selection": "assets/starlight-constellation/v2-preview/research-team/face-eye-study-v1/phase-d-morphology-silhouettes/morphology-selection.v1.json",
    "founder_review": "assets/starlight-constellation/v2-preview/research-team/face-eye-study-v1/FOUNDER_REVIEW_STATUS.md",
    "asset_program": "assets/starlight-constellation/v2-preview/research-team/face-eye-study-v1/asset-program.v2.json"
  },
  "collection_dispositions": [
    {
      "collection_id": "founding-portraits-v1",
      "evidence_ref": "assets/starlight-constellation/v1/visual-provenance.manifest.json",
      "disposition": "retain-continuity",
      "pixel_use": "production-continuity",
      "allowed_surfaces": ["cinematic-hero", "constellation-story", "ai-agent-profile"],
      "prohibited_surfaces": ["ai-workflow", "org-explainer", "academy-story", "marketplace-card", "runtime-directory", "runtime-graph"],
      "rationale": "These fifty portraits carry the strongest founder-recognized Starlight continuity and premium emotion, but their repeated humanoid, halo, pedestal, and ceremonial cues are not operational truth.",
      "human_decision": "iterate"
    },
    {
      "collection_id": "phase-a-form-study",
      "evidence_ref": "assets/starlight-constellation/v2-preview/research-team/face-eye-study-v1/phase-a-contact-sheet.png",
      "disposition": "research-reference",
      "pixel_use": "noindex-research",
      "allowed_surfaces": ["research-lab"],
      "prohibited_surfaces": ["cinematic-hero", "ai-agent-profile", "ai-workflow", "org-explainer", "academy-story", "marketplace-card", "runtime-directory", "runtime-graph"],
      "rationale": "The sheet is useful for comparing silhouette and facial architecture, especially architectural and screenless seeds, but most candidates repeat generic tall humanoid robot grammar.",
      "human_decision": "pending"
    },
    {
      "collection_id": "phase-c-style-languages",
      "evidence_ref": "assets/starlight-constellation/v2-preview/research-team/face-eye-study-v1/phase-c-style-languages/FOUNDER_REJECTION.md",
      "disposition": "founder-rejected",
      "pixel_use": "blocked",
      "allowed_surfaces": [],
      "prohibited_surfaces": ["cinematic-hero", "constellation-story", "ai-agent-profile", "ai-workflow", "org-explainer", "academy-story", "marketplace-card", "runtime-directory", "runtime-graph", "research-lab"],
      "rationale": "Frank explicitly rejected this visual direction; it remains only as textual negative evidence so future makers do not accidentally revive the same style family.",
      "human_decision": "reject"
    },
    {
      "collection_id": "phase-d-morphology-boards",
      "evidence_ref": "assets/starlight-constellation/v2-preview/research-team/face-eye-study-v1/phase-d-morphology-silhouettes/morphology-selection.v1.json",
      "disposition": "evolve",
      "pixel_use": "reference-only",
      "allowed_surfaces": ["research-lab"],
      "prohibited_surfaces": ["cinematic-hero", "constellation-story", "ai-agent-profile", "ai-workflow", "org-explainer", "academy-story", "marketplace-card", "runtime-directory", "runtime-graph"],
      "rationale": "The boards establish a valuable role-shaped morphology vocabulary, but every image is a design sketch rather than a character master and the selected families still need silhouette and small-crop proof.",
      "human_decision": "pending"
    },
    {
      "collection_id": "phase-e-i-style-and-story-tests",
      "evidence_ref": "assets/starlight-constellation/v2-preview/research-team/face-eye-study-v1/phase-e-i-independent-critique.md",
      "disposition": "research-reference",
      "pixel_use": "noindex-research",
      "allowed_surfaces": ["research-lab"],
      "prohibited_surfaces": ["cinematic-hero", "constellation-story", "ai-agent-profile", "ai-workflow", "org-explainer", "academy-story", "marketplace-card", "runtime-directory", "runtime-graph"],
      "rationale": "The set contains useful craft and composition hypotheses, but the independent review found no production-approved identity and the founder has not selected a replacement direction.",
      "human_decision": "pending"
    },
    {
      "collection_id": "i04-supervised-mission-composition",
      "evidence_ref": "assets/starlight-constellation/v2-preview/research-team/face-eye-study-v1/phase-i-agent-lifecycle-v1/i04-first-supervised-mission-v1.png",
      "disposition": "research-reference",
      "pixel_use": "reference-only",
      "allowed_surfaces": ["research-lab"],
      "prohibited_surfaces": ["cinematic-hero", "constellation-story", "ai-agent-profile", "ai-workflow", "org-explainer", "academy-story", "marketplace-card", "runtime-directory", "runtime-graph"],
      "rationale": "Its maker-verifier-human-gate staging is the strongest workflow seed, but every interface element and label must be rebuilt deterministically and its pixels are not approved for production.",
      "human_decision": "pending"
    },
    {
      "collection_id": "lyra-civic-editorial-pilot",
      "evidence_ref": "assets/starlight-constellation/v2-preview/next-pass/foundation-application-quartet/reviews/lyra-civic-editorial-identity-v1.quality-review.md",
      "disposition": "negative-evidence",
      "pixel_use": "noindex-research",
      "allowed_surfaces": ["research-lab"],
      "prohibited_surfaces": ["cinematic-hero", "constellation-story", "ai-agent-profile", "ai-workflow", "org-explainer", "academy-story", "marketplace-card", "runtime-directory", "runtime-graph"],
      "rationale": "The pilot scored twenty-one of thirty: strong tactile craft and human handoff, but weak Lyra identity preservation, missing routing function, and generic premium humanoid robot styling.",
      "human_decision": "pending"
    }
  ],
  "surface_contracts": [
    {
      "surface_id": "cinematic-hero",
      "primary_audience": ["creator", "reader"],
      "character_mode": "One signature character performing one meaningful act inside a specific world.",
      "required_truth": ["real role instrument", "human authority boundary", "source and rights provenance"],
      "success_read": "Emotion opens the story, then one visible action makes the agent specialty legible without decorative lore.",
      "avoid": ["ensemble wallpaper", "ceremonial authority", "generic cosmic spectacle"]
    },
    {
      "surface_id": "constellation-story",
      "primary_audience": ["creator", "reader", "educator"],
      "character_mode": "Editorial cast storytelling with strong silhouette contrast and episodic handoffs.",
      "required_truth": ["named relationship", "bounded mission", "consequence and reflection"],
      "success_read": "A reader remembers who acted, why the handoff happened, and what changed after the mission.",
      "avoid": ["lore without action", "equal visual weight for every agent", "power-level hierarchy"]
    },
    {
      "surface_id": "ai-agent-profile",
      "primary_audience": ["creator", "developer", "operator"],
      "character_mode": "Identity view beside exact system and workflow views, never replacing them.",
      "required_truth": ["skills and non-capabilities", "inputs transformation and outputs", "version and installability", "human gate"],
      "success_read": "The visitor likes the character but adopts the agent because its purpose, limits, evidence, and compatibility are explicit.",
      "avoid": ["portrait-only dossier", "fictional runtime claims", "hidden permission boundaries"]
    },
    {
      "surface_id": "ai-workflow",
      "primary_audience": ["developer", "operator", "creator"],
      "character_mode": "Role silhouettes anchor a deterministic typed handoff diagram with proof artifacts.",
      "required_truth": ["typed edges", "failure route", "reviewer differs from maker", "human approval point"],
      "success_read": "A developer can predict the handoffs, evidence, stops, and human decisions without reading character lore.",
      "avoid": ["generated UI", "decorative node orbit", "animation that hides state"]
    },
    {
      "surface_id": "org-explainer",
      "primary_audience": ["reader", "developer", "public-interest-practitioner"],
      "character_mode": "Evidence instruments, clean biotech, and bounded rooms used as explanatory diagrams.",
      "required_truth": ["method and sources", "uncertainty", "public-interest boundary", "reproducible evidence"],
      "success_read": "The visual makes a method easier to inspect and teach, while remaining credible without a fantasy premise.",
      "avoid": ["luxury science fiction", "cute authority", "unlabeled speculation"]
    },
    {
      "surface_id": "academy-story",
      "primary_audience": ["reader", "educator", "creator"],
      "character_mode": "Compact guides, mechanical creatures, and room intelligences for low-consequence learning scenes.",
      "required_truth": ["learning objective", "human values reflection", "supervision", "transferable skill"],
      "success_read": "Warmth invites return visits, while competence comes from teaching behavior rather than baby-schema features.",
      "avoid": ["named-studio imitation", "oversized eyes", "childlike authority"]
    },